article_id,filename,year,decade,journal,title,doi,coding_basis,Source_Type,Evidence_Type,Primary_Methodology,Conceptual_Theme,Library_Context,Game_Format,Service_Area,Service_Audience,Intended_Outcome,Evidence_Confidence,Service_Conditions_Addressed
knightdavis2008,knightdavis2008.md,2008,2000s,College & Research Libraries,Analysis of Citations in Undergraduate Papers,not available from source,citation_and_abstract_only,peer_reviewed_journal_article,empirical_study,content_analysis,not_identified,academic_library,unspecified_game_format,not_applicable,not_applicable,not_applicable,demonstrated_outcome,not_applicable
knowlton2016,knowlton2016.md,2016,2010s,College & Research Libraries,A Two-Step Model for Assessing Relative Interest in E-books Compared to Print,not available from source,citation_and_abstract_only,peer_reviewed_journal_article,instrument_or_framework_development,theoretical_or_conceptual,not_identified,academic_library,unspecified_game_format,collections_and_access,not_applicable,not_applicable,theoretical_or_conceptual,not_applicable
knox2014-1,knox2014-1.md,2014,2010s,Library Trends,“The Books Will Still Be in the Library”: Narrow Definitions of Censorship in the Discourse of Challengers,10.1353/lib.2014.0020,citation_and_abstract_only,peer_reviewed_journal_article,content_or_artifact_analysis,content_analysis,not_identified,unspecified_library_context,unspecified_game_format,not_applicable,not_applicable,not_applicable,descriptive_only,not_applicable
knox2014,knox2014.md,2014,2010s,Library Trends,Intellectual Freedom and the Agnostic–Postmodernist View of Reading Effects,10.1353/lib.2014.0021,citation_and_abstract_only,peer_reviewed_journal_article,theoretical_or_conceptual,theoretical_or_conceptual,not_identified,unspecified_library_context,unspecified_game_format,not_applicable,not_applicable,not_applicable,theoretical_or_conceptual,not_applicable
knox2020,knox2020.md,2020,2020s,Information Technology and Libraries,Google Us!,10.6017/ital.v39i1.12089,citation_and_abstract_only,peer_reviewed_journal_article,practitioner_reflection,none,not_identified,public_library,unspecified_game_format,not_applicable,not_applicable,not_applicable,practitioner_knowledge,not_applicable
knutson2007,knutson2007.md,2007,2000s,Library Trends,New Realities: Libraries in Post-Soviet Russia,10.1353/lib.2007.0011,citation_and_abstract_only,peer_reviewed_journal_article,implementation_case,case_or_design_study,not_identified,public_library,unspecified_game_format,not_applicable,general_public,not_applicable,descriptive_only,not_applicable
koenig1971,koenig1971.md,1971,1970s,Information Technology and Libraries,SCOPE: A Cost Analysis of an Automated Serials Record System,10.6017/ital.v4i3.5590,citation_and_abstract_only,peer_reviewed_journal_article,empirical_study,none,not_identified,non_library_context,unspecified_game_format,collections_and_access,not_applicable,not_applicable,promising_evidence,sustainable_operations
koenig2025,koenig2025.md,2025,2020s,College & Research Libraries,Assessing the Impact of Consultations with Librarians on Faculty Research: An Explanatory Sequential Mixed Methods Study,not available from source,citation_and_abstract_only,peer_reviewed_journal_article,empirical_study,mixed_methods,not_identified,academic_library,unspecified_game_format,not_applicable,educators,not_applicable,promising_evidence,not_applicable
kogut2019,kogut2019.md,2019,2010s,College & Research Libraries,Critical Appraisal of Mathematics Education Systematic Review Search Methods: Implications for Social Sciences Librarians,not available from source,citation_and_abstract_only,peer_reviewed_journal_article,evidence_synthesis,content_analysis,information_behavior_and_practice,academic_library,unspecified_game_format,not_applicable,educators,institutional_capacity,theoretical_or_conceptual,not_applicable
koh2021,koh2021.md,2021,2020s,Information Technology and Libraries,Topic Modeling as a Tool for Analyzing Library Chat Transcripts,10.6017/ital.v40i3.13333,citation_and_abstract_only,peer_reviewed_journal_article,content_or_artifact_analysis,content_analysis,not_identified,academic_library,unspecified_game_format,not_applicable,not_applicable,not_applicable,promising_evidence,not_applicable
kohl2006,kohl2006.md,2006,2000s,Library Trends,More Bang for the Buck: Increasing the Effectiveness of Library Expenditures Through Cooperation,10.1353/lib.2006.0022,citation_and_abstract_only,peer_reviewed_journal_article,theoretical_or_conceptual,none,not_identified,academic_library,unspecified_game_format,professional_capacity,not_applicable,institutional_capacity,theoretical_or_conceptual,not_applicable
kohn2013,kohn2013.md,2013,2010s,College & Research Libraries,Usage-Based Collection Evaluation with a Curricular Focus,not available from source,citation_and_abstract_only,peer_reviewed_journal_article,implementation_case,unspecified,not_identified,academic_library,unspecified_game_format,collections_and_access,students,collections_and_access,descriptive_only,not_applicable
kohn2018,kohn2018.md,2018,2010s,College & Research Libraries,Worth the Wait? Using Past Patterns to Determine Wait Periods for E-Books Released After Print,not available from source,citation_and_abstract_only,peer_reviewed_journal_article,empirical_study,content_analysis,not_identified,academic_library,unspecified_game_format,not_applicable,not_applicable,not_applicable,demonstrated_outcome,not_applicable
kong2017,kong2017.md,2017,2010s,College & Research Libraries,Developing Library GIS Services for Humanities and Social Science: An Action Research Approach,not available from source,citation_and_abstract_only,peer_reviewed_journal_article,implementation_case,action_research,not_identified,academic_library,unspecified_game_format,not_applicable,not_applicable,not_applicable,medium,not_applicable
koob2022,koob2022.md,2022,2020s,Information Technology and Libraries,Tech Tools in Pandemic-Transformed Information Literacy Instruction,10.6017/ital.v41i4.15383,citation_and_abstract_only,peer_reviewed_journal_article,empirical_study,content_analysis,not_identified,academic_library,unspecified_game_format,learning_and_literacy,students,equitable_access,promising_evidence,access_infrastructure_required|inclusive_design_or_accessibility|sustainable_operations
kooy2016,kooy2016.md,2016,2010s,College & Research Libraries,Building Virtually Free Subject Area Expertise through Social Media: An Exploratory Study,not available from source,citation_and_abstract_only,peer_reviewed_journal_article,evidence_synthesis,unspecified,not_identified,academic_library,unspecified_game_format,not_applicable,not_applicable,not_applicable,descriptive_only,not_applicable
kordahi2022,kordahi2022.md,2022,2020s,Information Technology and Libraries,Ontology for the User-Learner Profile Personalizes the Search Analysis of Online Learning Resources,10.6017/ital.v41i2.13601,citation_and_abstract_only,peer_reviewed_journal_article,instrument_or_framework_development,theoretical_or_conceptual,information_behavior_and_practice,academic_library,unspecified_game_format,not_applicable,not_applicable,not_applicable,theoretical_or_conceptual,not_applicable
kosavic2017,kosavic2017.md,2017,2010s,College & Research Libraries,"Developing Digital Scholarship: Emerging Practices in Academic Libraries. Alison Mackenzie and Lindsey Martin, eds. Chicago: ALA Neal Schuman, 2016. 184p. Paper, $70.00 (ISBN: 978-0-8389-1555-4). LC 2017289052.",not available from source,citation_and_abstract_only,book,evidence_synthesis,evidence_synthesis,not_identified,academic_library,unspecified_game_format,professional_capacity,educators,institutional_capacity,practitioner_knowledge,sustainable_operations
kostelecky2023,kostelecky2023.md,2023,2020s,College & Research Libraries,Is Cultural Humility Too Easy?,not available from source,citation_and_abstract_only,peer_reviewed_journal_article,theoretical_or_conceptual,theoretical_or_conceptual,social_equity_and_access,unspecified_library_context,unspecified_game_format,not_applicable,not_applicable,not_applicable,theoretical_or_conceptual,not_applicable
kostoska2014,kostoska2014.md,2014,2010s,Library Trends,Libraries and Librarianship in the Republic of Macedonia,10.1353/lib.2014.0040,citation_and_abstract_only,peer_reviewed_journal_article,practitioner_reflection,none,not_identified,unspecified_library_context,unspecified_game_format,not_applicable,not_applicable,not_applicable,descriptive_only,not_applicable
kot2015,kot2015.md,2015,2010s,College & Research Libraries,The Impact of Library Resource Utilization on Undergraduate Students’ Academic Performance: A Propensity Score Matching Design,not available from source,citation_and_abstract_only,peer_reviewed_journal_article,empirical_study,experimental_study,not_identified,academic_library,unspecified_game_format,collections_and_access,students,learning_and_literacy,demonstrated_outcome,not_applicable
kotua2026,kotua2026.md,2026,2020s,Information Technology and Libraries,Case Study of the Implementation of AI Primo Research Assistant (Beta Version) in Academic Libraries in Poland,10.5860/ital.v45i2.17479,citation_and_abstract_only,peer_reviewed_journal_article,empirical_study,survey,not_identified,academic_library,unspecified_game_format,"discovery_and_advisory, professional_capacity",not_applicable,not_applicable,medium,not_applicable
koufogiannakis2015,koufogiannakis2015.md,2015,2010s,College & Research Libraries,Determinants of Evidence Use in Academic Librarian Decision Making,not available from source,citation_and_abstract_only,peer_reviewed_journal_article,empirical_study,qualitative_study,not_identified,academic_library,unspecified_game_format,not_applicable,not_applicable,not_applicable,descriptive_only,not_applicable
kountz1968,kountz1968.md,1968,1960s,Information Technology and Libraries,Cost Comparison of Computer Versus Manual Catalog Maintenance,10.6017/ital.v1i3.2932,citation_and_abstract_only,peer_reviewed_journal_article,empirical_study,empirical_study,not_identified,public_library,unspecified_game_format,collections_and_access,not_applicable,not_applicable,promising_evidence,not_applicable
kountz1972,kountz1972.md,1972,1970s,Information Technology and Libraries,BIBLIOS Revisited,10.6017/ital.v5i2.5731,citation_and_abstract_only,peer_reviewed_journal_article,practitioner_reflection,none,not_identified,public_library,unspecified_game_format,collections_and_access,not_applicable,not_applicable,descriptive_only,not_applicable
kovalcik2019,kovalcik2019.md,2019,2010s,Information Technology and Libraries,Automated Storage & Retrieval System,10.6017/ital.v38i4.11273,citation_and_abstract_only,peer_reviewed_journal_article,implementation_case,case_or_design_study,not_identified,academic_library,unspecified_game_format,collections_and_access,not_applicable,not_applicable,descriptive_only,access_infrastructure_required|skilled_facilitation_required|sustainable_operations
krahmer2020,krahmer2020.md,2020,2020s,Information Technology and Libraries,A Collaborative Approach to Newspaper Preservation,10.6017/ital.v39i3.12593,citation_and_abstract_only,peer_reviewed_journal_article,implementation_case,none,not_identified,"public_library, academic_library",unspecified_game_format,collections_and_access,not_applicable,"equitable_access, cultural_stewardship_and_preservation",descriptive_only,"access_infrastructure_required, community_assessment_needed"
kramer2023,kramer2023.md,2023,2020s,College & Research Libraries,"Academic Libraries and Collaborative Research Services. Carrie Forbes, ed. Lanham, MD: Rowman Littlefield, 2022. 312 pp. Hardcover, $150 (978-1-5381-5368-0).",not available from source,citation_and_abstract_only,peer_reviewed_journal_article,evidence_synthesis,none,not_identified,academic_library,unspecified_game_format,not_applicable,not_applicable,not_applicable,theoretical_or_conceptual,not_applicable
krastev2015,krastev2015.md,2015,2010s,Library Trends,"Democracy and Libraries: Modernizing and Rebuilding Bulgarian Libraries with US Support, 1990–2014",10.1353/lib.2015.0026,citation_and_abstract_only,peer_reviewed_journal_article,historical_analysis,none,not_identified,unspecified_library_context,unspecified_game_format,not_applicable,not_applicable,not_applicable,descriptive_only,not_applicable
kreitz2009,kreitz2009.md,2009,2000s,College & Research Libraries,Leadership and Emotional Intelligence: A Study of University Library Directors and Their Senior Management Teams,not available from source,citation_and_abstract_only,peer_reviewed_journal_article,empirical_study,survey,not_identified,academic_library,unspecified_game_format,not_applicable,not_applicable,not_applicable,promising_evidence,not_applicable
krsticev2013,krsticev2013.md,2013,2010s,Information Technology and Libraries,Information Retrieval Using a Middleware Approach,10.6017/ital.v32i1.1941,citation_and_abstract_only,peer_reviewed_journal_article,instrument_or_framework_development,theoretical_or_conceptual,not_identified,unspecified_library_context,unspecified_game_format,collections_and_access,not_applicable,not_applicable,theoretical_or_conceptual,not_applicable
kruger2005,kruger2005.md,2005,2000s,Information Technology and Libraries,"I, Librarian",10.6017/ital.v24i3.3373,citation_and_abstract_only,peer_reviewed_journal_article,theoretical_or_conceptual,none,not_identified,unspecified_library_context,unspecified_game_format,not_applicable,not_applicable,not_applicable,theoretical_or_conceptual,not_applicable
krummel2013,krummel2013.md,2013,2010s,Library Trends,The Heritage of Boleslas Iwinski,10.1353/lib.2013.0044,citation_and_abstract_only,peer_reviewed_journal_article,historical_analysis,historical_analysis,not_identified,unspecified_library_context,unspecified_game_format,not_applicable,not_applicable,not_applicable,theoretical_or_conceptual,not_applicable
krymskaya2024,krymskaya2024.md,2024,2020s,Library Trends,Knowledge Management Status in Russian Higher Education,10.1353/lib.2024.a941430,citation_and_abstract_only,peer_reviewed_journal_article,evidence_synthesis,evidence_synthesis,not_identified,academic_library,unspecified_game_format,not_applicable,not_applicable,not_applicable,theoretical_or_conceptual,not_applicable
krzyzanowski2017,krzyzanowski2017.md,2017,2010s,Information Technology and Libraries,Electronic Library for Scientific Journals: Consortium Project in Brazil,10.6017/ital.v19i2.10079,citation_and_abstract_only,peer_reviewed_journal_article,implementation_case,none,not_identified,academic_library,unspecified_game_format,collections_and_access,not_applicable,equitable_access,descriptive_only,not_applicable
kugelmeyer2018,kugelmeyer2018.md,2018,2010s,College & Research Libraries,Curating Research Data. Volume One: Practical Strategies for Your Digital Repository (ISBN: 978-0-8389-8858-9) and Curating Research Data. Volume Two: A Handbook of Current Practice (ISBN: 978-0-8389-8862-6).,not available from source,citation_and_abstract_only,peer_reviewed_journal_article,evidence_synthesis,evidence_synthesis,not_identified,academic_library,unspecified_game_format,not_applicable,not_applicable,not_applicable,theoretical_or_conceptual,not_applicable
kugelmeyer2019,kugelmeyer2019.md,2019,2010s,College & Research Libraries,"Andrew Weiss. Big Data Shocks: An Introduction to Big Data for Librarians and Information Professionals. Chicago: American Library Association, 2018. 194p. Paper, $45.00 (ISBN: 978-1-5381-0323-4).",not available from source,citation_and_abstract_only,peer_reviewed_journal_article,evidence_synthesis,none,not_identified,academic_library,unspecified_game_format,not_applicable,not_applicable,not_applicable,theoretical_or_conceptual,not_applicable
kuglitsch2017,kuglitsch2017.md,2017,2010s,Information Technology and Libraries,"Facilitating Research Consultations Using Cloud Services: Experiences, Preferences, and Best Practices",10.6017/ital.v36i1.8923,citation_and_abstract_only,peer_reviewed_journal_article,empirical_study,unspecified,not_identified,academic_library,unspecified_game_format,discovery_and_advisory,students,engagement_and_participation,promising_evidence,not_applicable
kuh2003,kuh2003.md,2003,2000s,College & Research Libraries,The Role of the Academic Library in Promoting Student Engagement in Learning,not available from source,citation_and_abstract_only,peer_reviewed_journal_article,empirical_study,survey,information_behavior_and_practice,academic_library,unspecified_game_format,learning_and_literacy,students,learning_and_literacy,medium,not_applicable
kuh2015,kuh2015.md,2015,2010s,College & Research Libraries,The Role of the Academic Library in Promoting Student Engagement in Learning,not available from source,citation_and_abstract_only,peer_reviewed_journal_article,empirical_study,survey,information_behavior_and_practice,academic_library,unspecified_game_format,learning_and_literacy,students,learning_and_literacy,medium,not_applicable
kulisiewicz2010,kulisiewicz2010.md,2010,2010s,Library Trends,"The Sejm Library, 1919-2009",10.1353/lib.2010.0010,citation_and_abstract_only,peer_reviewed_journal_article,historical_analysis,historical_analysis,not_identified,unspecified_library_context,unspecified_game_format,"collections_and_access, cultural_heritage_and_research",not_applicable,not_applicable,theoretical_or_conceptual,not_applicable
kumaran2025,kumaran2025.md,2025,2020s,College & Research Libraries,Marginalized Graduate Students Navigating the Academy During the Covid-19 Pandemic: A Phenomenological Approach,not available from source,citation_and_abstract_only,peer_reviewed_journal_article,empirical_study,qualitative_study,social_equity_and_access,academic_library,unspecified_game_format,not_applicable,underserved_or_special_population,equitable_access,practitioner_knowledge,"access_infrastructure_required, inclusive_design_or_accessibility"
kumasi2015,kumasi2015.md,2015,2010s,Library Trends,Finding “Diversity Levers” in the Core Library and Information Science Curriculum: A Social Justice Imperative,10.1353/lib.2015.0047,citation_and_abstract_only,peer_reviewed_journal_article,empirical_study,survey,social_equity_and_access,library_school,unspecified_game_format,not_applicable,not_applicable,not_applicable,promising_evidence,not_applicable
kumbier2016,kumbier2016.md,2016,2010s,Library Trends,Access Is Not Problem Solving: Disability Justice and Libraries,10.1353/lib.2016.0004,citation_and_abstract_only,peer_reviewed_journal_article,theoretical_or_conceptual,theoretical_or_conceptual,social_equity_and_access,unspecified_library_context,unspecified_game_format,not_applicable,not_applicable,not_applicable,theoretical_or_conceptual,not_applicable
kurtz2010,kurtz2010.md,2010,2010s,Information Technology and Libraries,"Dublin Core, DSpace, and a Brief Analysis of Three University Repositories",10.6017/ital.v29i1.3157,citation_and_abstract_only,peer_reviewed_journal_article,content_or_artifact_analysis,content_analysis,not_identified,academic_library,unspecified_game_format,not_applicable,not_applicable,not_applicable,descriptive_only,skilled_facilitation_required
kutner2009,kutner2009.md,2009,2000s,College & Research Libraries,"Think Locally, Act Globally: Understanding Home Institution Library Engagement among Study-Abroad Students",not available from source,citation_and_abstract_only,peer_reviewed_journal_article,empirical_study,survey,not_identified,academic_library,unspecified_game_format,not_applicable,not_applicable,not_applicable,promising_evidence,not_applicable
kuyperrushing2002,kuyperrushing2002.md,2002,2000s,College & Research Libraries,Music Libraries: Centralization versus Decentralization,not available from source,citation_and_abstract_only,peer_reviewed_journal_article,empirical_study,survey,not_identified,academic_library,unspecified_game_format,collections_and_access,not_applicable,not_applicable,descriptive_only,not_applicable
kvale2021,kvale2021.md,2021,2020s,College & Research Libraries,Using Personas to Visualize the Need for Data Stewardship,not available from source,citation_and_abstract_only,peer_reviewed_journal_article,evidence_synthesis,evidence_synthesis,not_identified,academic_library,unspecified_game_format,not_applicable,not_applicable,not_applicable,promising_evidence,not_applicable
kwak2025,kwak2025.md,2025,2020s,College & Research Libraries,Developing a Training Program for Student Library Assistants to Make Scanned PDFs Accessible: A Case Study,not available from source,citation_and_abstract_only,peer_reviewed_journal_article,implementation_case,case_or_design_study,not_identified,academic_library,unspecified_game_format,professional_capacity,students,institutional_capacity,descriptive_only,"skilled_facilitation_required, sustainable_operations"
kwon2008,kwon2008.md,2008,2000s,College & Research Libraries,A Mixed-Methods Investigation of the Relationship between Critical Thinking and Library Anxiety among Undergraduate Students in their Information Search Process,not available from source,citation_and_abstract_only,peer_reviewed_journal_article,empirical_study,mixed_methods,information_behavior_and_practice,academic_library,unspecified_game_format,not_applicable,students,not_applicable,theoretical_or_conceptual,not_applicable
kyrillidou2008,kyrillidou2008.md,2008,2000s,Library Trends,The Evolution of Measurement and Evaluation of Libraries: A Perspective from the Association of Research Libraries,10.1353/lib.0.0008,citation_and_abstract_only,peer_reviewed_journal_article,evidence_synthesis,evidence_synthesis,theoretical_or_conceptual,unspecified_library_context,unspecified_game_format,not_applicable,educators,not_applicable,theoretical_or_conceptual,not_applicable
labaree2006,labaree2006.md,2006,2000s,Library Trends,Encounters with the Library: Understanding Experience Using the Life History Method,10.1353/lib.2006.0048,citation_and_abstract_only,peer_reviewed_journal_article,theoretical_or_conceptual,qualitative_study,not_identified,unspecified_library_context,unspecified_game_format,not_applicable,not_applicable,not_applicable,theoretical_or_conceptual,not_applicable
lacasta2007,lacasta2007.md,2007,2000s,Information Technology and Libraries,ThManager: An Open Source Tool for Creating and Visualizing SKOS,10.6017/ital.v26i3.3274,citation_and_abstract_only,peer_reviewed_journal_article,instrument_or_framework_development,none,not_identified,unspecified_library_context,unspecified_game_format,collections_and_access,not_applicable,not_applicable,descriptive_only,not_applicable
lacey2022,lacey2022.md,2022,2020s,College & Research Libraries,"Racial Imposter Syndrome, White Presenting, and Burnout in the One-Shot Classroom",not available from source,citation_and_abstract_only,peer_reviewed_journal_article,practitioner_reflection,none,social_equity_and_access,academic_library,unspecified_game_format,not_applicable,not_applicable,not_applicable,theoretical_or_conceptual,not_applicable
lacroix2006,lacroix2006.md,2006,2000s,Library Trends,Organizing Electronic Information to Serve the Needs of Health Practitioners and Customers,10.1353/lib.2006.0038,citation_and_abstract_only,peer_reviewed_journal_article,practitioner_reflection,none,not_identified,unspecified_library_context,unspecified_game_format,not_applicable,not_applicable,not_applicable,descriptive_only,not_applicable
lafond2000,lafond2000.md,2000,2000s,College & Research Libraries,Diversity in Collection Development: Comparing Access Strategies to Alternative Press Periodicals,not available from source,citation_and_abstract_only,peer_reviewed_journal_article,evidence_synthesis,unspecified,not_identified,academic_library,unspecified_game_format,not_applicable,not_applicable,equitable_access,descriptive_only,not_applicable
lai2013,lai2013.md,2013,2010s,Library Trends,"The Development, Current State, and Effects of Community Informatization in Mainland China",10.1353/lib.2013.0022,citation_and_abstract_only,peer_reviewed_journal_article,evidence_synthesis,evidence_synthesis,social_equity_and_access,non_library_context,unspecified_game_format,not_applicable,general_public,equitable_access,theoretical_or_conceptual,"access_infrastructure_required, community_assessment_needed"
lai2023,lai2023.md,2023,2020s,College & Research Libraries,How Well Does ChatGPT Handle Reference Inquiries? An Analysis Based on Question Types and Question Complexities,not available from source,citation_and_abstract_only,peer_reviewed_journal_article,empirical_study,content_analysis,not_identified,academic_library,unspecified_game_format,discovery_and_advisory,general_public,"equitable_access, discovery_and_advisory",promising_evidence,access_infrastructure_required
lamanna2019,lamanna2019.md,2019,2010s,Information Technology and Libraries,On Educating Patrons On Privacy And Maximizing Library Resources,10.6017/ital.v38i3.11571,citation_and_abstract_only,peer_reviewed_journal_article,practitioner_reflection,none,not_identified,unspecified_library_context,unspecified_game_format,not_applicable,not_applicable,not_applicable,practitioner_knowledge,not_applicable
lambert2021,lambert2021.md,2021,2020s,College & Research Libraries,Making Sense of Student Source Selection: Using the WHY Method to Analyze Authority in Student Research Bibliographies,not available from source,citation_and_abstract_only,peer_reviewed_journal_article,empirical_study,content_analysis,information_behavior_and_practice,academic_library,unspecified_game_format,not_applicable,students,not_applicable,demonstrated_outcome,not_applicable
lamont2009,lamont2009.md,2009,2000s,Information Technology and Libraries,"Gender, Technology, and Libraries",10.6017/ital.v28i3.3221,citation_and_abstract_only,peer_reviewed_journal_article,evidence_synthesis,evidence_synthesis,social_equity_and_access,unspecified_library_context,unspecified_game_format,not_applicable,not_applicable,not_applicable,theoretical_or_conceptual,not_applicable
