article_id,filename,year,decade,journal,title,doi,coding_basis,Source_Type,Evidence_Type,Primary_Methodology,Conceptual_Theme,Library_Context,Game_Format,Service_Area,Service_Audience,Intended_Outcome,Evidence_Confidence,Service_Conditions_Addressed
powell2006,powell2006.md,2006,2000s,Library Trends,Evaluation Research: An Overview,10.1353/lib.2006.0050,citation_and_abstract_only,peer_reviewed_journal_article,evidence_synthesis,theoretical_or_conceptual,not_identified,unspecified_library_context,unspecified_game_format,not_applicable,not_applicable,not_applicable,theoretical_or_conceptual,not_applicable
powell2011,powell2011.md,2011,2010s,Information Technology and Libraries,Graphs in Libraries: A Primer,10.6017/ital.v30i4.1867,citation_and_abstract_only,peer_reviewed_journal_article,evidence_synthesis,none,theoretical_or_conceptual,academic_library,unspecified_game_format,not_applicable,not_applicable,not_applicable,theoretical_or_conceptual,not_applicable
powell2013,powell2013.md,2013,2010s,Library Trends,Get in the Game: Encouraging Play and Game Creation to Develop New Literacies in the Library,10.1353/lib.2013.0011,citation_and_abstract_only,peer_reviewed_journal_article,implementation_case,unspecified,game_literacy|educational_psychology,unspecified_library_context,digital_game|live_action_roleplaying_game,learning_and_literacy|programming_and_facilitation,children|teens,learning_and_literacy|engagement_and_participation,descriptive_only,not_applicable
praczyk2013,praczyk2013.md,2013,2010s,Information Technology and Libraries,Automatic Extraction of Figures from Scientific Publications in High-Energy Physics,10.6017/ital.v32i4.3670,citation_and_abstract_only,peer_reviewed_journal_article,instrument_or_framework_development,content_analysis,not_identified,unspecified_library_context,unspecified_game_format,not_applicable,not_applicable,not_applicable,theoretical_or_conceptual,not_applicable
preer2007,preer2007.md,2007,2000s,Library Trends,Man's Right to Knowledge: Libraries and Columbia University's 1954 Cold War Bicentennial,10.1353/lib.2007.0019,citation_and_abstract_only,peer_reviewed_journal_article,historical_analysis,historical_analysis,not_identified,academic_library,unspecified_game_format,not_applicable,not_applicable,not_applicable,theoretical_or_conceptual,not_applicable
preer2014,preer2014.md,2014,2010s,Library Trends,Prepare to Be Challenged!,10.1353/lib.2014.0018,citation_and_abstract_only,peer_reviewed_journal_article,evidence_synthesis,content_analysis,not_identified,public_library,unspecified_game_format,collections_and_access,not_applicable,not_applicable,descriptive_only,skilled_facilitation_required|evaluation_or_reflection|sustainable_operations
premji2022,premji2022.md,2022,2020s,College & Research Libraries,An Exploration of Business Librarian Participation in Knowledge Synthesis Reviews,not available from source,citation_and_abstract_only,peer_reviewed_journal_article,empirical_study,survey,not_identified,academic_library,unspecified_game_format,professional_capacity,educators,institutional_capacity,promising_evidence,sustainable_operations|skilled_facilitation_required
preston1998,preston1998.md,1998,1990s,College & Research Libraries,Perceptions of Discriminatory Practices and Attitudes: A Survey of African American Librarians,not available from source,citation_and_abstract_only,peer_reviewed_journal_article,empirical_study,survey,social_equity_and_access,unspecified_library_context,unspecified_game_format,not_applicable,not_applicable,not_applicable,practitioner_knowledge,not_applicable
price2026,price2026.md,2026,2020s,Library Trends,Fostering Data Literacy by Bridging Interdisciplinary Divides: Three Perspectives on Data Literacy Support at the University Level,10.1353/lib.2026.a983009,citation_and_abstract_only,peer_reviewed_journal_article,implementation_case,case_or_design_study,information_behavior_and_practice,academic_library,unspecified_game_format,learning_and_literacy,students,"learning_and_literacy, engagement_and_participation",practitioner_knowledge,not_applicable
priddle2015,priddle2015.md,2015,2010s,College & Research Libraries,Off-Site Storage and Special Collections: A Study in Use and Impact in ARL Libraries in the United States,not available from source,citation_and_abstract_only,peer_reviewed_journal_article,empirical_study,survey,not_identified,academic_library,unspecified_game_format,collections_and_access,not_applicable,not_applicable,promising_evidence,access_infrastructure_required
prince2021,prince2021.md,2021,2020s,College & Research Libraries,"Deconstructing Service in Libraries: Intersections of Identities and Expectations. Veronica Arellano Douglas and Joanna Gadsby, eds. Sacramento, CA: Litwin Books, 2020. 404p. Paperback, $22.75 (ISBN 978-1634000604).",not available from source,citation_and_abstract_only,peer_reviewed_journal_article,evidence_synthesis,evidence_synthesis,not_identified,multiple_library_types,unspecified_game_format,not_applicable,not_applicable,not_applicable,theoretical_or_conceptual,not_applicable
promann2015,promann2015.md,2015,2010s,Information Technology and Libraries,Applying Hierarchical Task Analysis Method to Discovery Layer Evaluation,10.6017/ital.v34i1.5600,citation_and_abstract_only,peer_reviewed_journal_article,instrument_or_framework_development,content_analysis,not_identified,unspecified_library_context,unspecified_game_format,not_applicable,not_applicable,not_applicable,theoretical_or_conceptual,not_applicable
pulido2011,pulido2011.md,2011,2010s,Library Trends,Library Services in Spanish Prisons: Current State of Affairs,10.1353/lib.2011.0009,citation_and_abstract_only,peer_reviewed_journal_article,practitioner_reflection,unspecified,not_identified,non_library_context,unspecified_game_format,not_applicable,underserved_or_special_population,not_applicable,descriptive_only,not_applicable
pulsifer1973,pulsifer1973.md,1973,1970s,Information Technology and Libraries,"Comparison of MARC Serials, NSDP, and ISBD-S",10.6017/ital.v6i4.5778,citation_and_abstract_only,peer_reviewed_journal_article,evidence_synthesis,content_analysis,not_identified,academic_library,unspecified_game_format,not_applicable,not_applicable,not_applicable,theoretical_or_conceptual,not_applicable
pun2016,pun2016.md,2016,2010s,Library Trends,"The Value of Intellectual Freedom in Twenty-First-Century China: Changes, Challenges, and Progress",10.1353/lib.2016.0000,citation_and_abstract_only,peer_reviewed_journal_article,content_or_artifact_analysis,content_analysis,not_identified,non_library_context,unspecified_game_format,not_applicable,not_applicable,not_applicable,theoretical_or_conceptual,not_applicable
purpur2017,purpur2017.md,2017,2010s,Information Technology and Libraries,"Mapping User Needs: Detailed GIS Services at the University of Nevada, Reno",10.6017/ital.v36i3.9157,citation_and_abstract_only,peer_reviewed_journal_article,empirical_study,survey,not_identified,academic_library,unspecified_game_format,professional_capacity,not_applicable,institutional_capacity,descriptive_only,access_infrastructure_required|skilled_facilitation_required|community_assessment_needed
qayyum2024,qayyum2024.md,2024,2020s,Library Trends,Knowledge Management: Educational Activities Supported by the Profession in the Australasian Region,10.1353/lib.2024.a941424,citation_and_abstract_only,peer_reviewed_journal_article,evidence_synthesis,evidence_synthesis,not_identified,unspecified_library_context,unspecified_game_format,not_applicable,not_applicable,not_applicable,theoretical_or_conceptual,not_applicable
qin2008,qin2008.md,2008,2000s,Library Trends,F. W. Lancaster: A Bibliometric Analysis,10.1353/lib.0.0010,citation_and_abstract_only,peer_reviewed_journal_article,evidence_synthesis,evidence_synthesis,not_identified,unspecified_library_context,unspecified_game_format,not_applicable,not_applicable,not_applicable,demonstrated_outcome,not_applicable
qing2022,qing2022.md,2022,2020s,Information Technology and Libraries,Research on Knowledge Organization of Intangible Cultural Heritage Based on Metadata,10.6017/ital.v41i2.14093,citation_and_abstract_only,peer_reviewed_journal_article,content_or_artifact_analysis,content_analysis,games_as_cultural_media,cultural_heritage_institution,unspecified_game_format,cultural_heritage_and_research,not_applicable,cultural_stewardship_and_preservation,theoretical_or_conceptual,not_applicable
quinn2010,quinn2010.md,2010,2010s,Information Technology and Libraries,Reducing Psychological Resistance to Digital Repositories,10.6017/ital.v29i2.3145,citation_and_abstract_only,peer_reviewed_journal_article,evidence_synthesis,evidence_synthesis,not_identified,academic_library,unspecified_game_format,collections_and_access,adults,not_applicable,theoretical_or_conceptual,not_applicable
quinn2015,quinn2015.md,2015,2010s,College & Research Libraries,The McDonaldization of Academic Libraries?,not available from source,citation_and_abstract_only,peer_reviewed_journal_article,theoretical_or_conceptual,theoretical_or_conceptual,not_identified,academic_library,unspecified_game_format,not_applicable,not_applicable,not_applicable,theoretical_or_conceptual,not_applicable
quinney2010,quinney2010.md,2010,2010s,Information Technology and Libraries,Bridging the Gap: Self-Directed Staff Technology Training,10.6017/ital.v29i4.3131,citation_and_abstract_only,peer_reviewed_journal_article,empirical_study,survey,educational_psychology,academic_library,unspecified_game_format,professional_capacity,educators,institutional_capacity,promising_evidence,not_applicable
quintel2020,quintel2020.md,2020,2020s,Information Technology and Libraries,Analytics and Privacy,10.6017/ital.v39i3.12219,citation_and_abstract_only,peer_reviewed_journal_article,implementation_case,none,not_identified,academic_library,unspecified_game_format,not_applicable,not_applicable,not_applicable,descriptive_only,not_applicable
raber2007,raber2007.md,2007,2000s,Library Trends,"ACONDA and ANACONDA: Social Change, Social Responsibility, and Librarianship",10.1353/lib.2007.0020,citation_and_abstract_only,peer_reviewed_journal_article,historical_analysis,historical_analysis,not_identified,unspecified_library_context,unspecified_game_format,not_applicable,not_applicable,not_applicable,theoretical_or_conceptual,not_applicable
rabina2021,rabina2021.md,2021,2020s,College & Research Libraries,"Richard E. Rubin and Rachel G. Rubin. Foundations of Library and Information Science. 5th ed. Chicago, IL: ALA Neal-Schuman, 2020. 656p. Paper.",not available from source,citation_and_abstract_only,peer_reviewed_journal_article,evidence_synthesis,none,not_identified,academic_library,unspecified_game_format,not_applicable,not_applicable,not_applicable,practitioner_knowledge,not_applicable
radford2006,radford2006.md,2006,2000s,Library Trends,The Critical Incident Technique and the Qualitative Evaluation of the Connecting Libraries and Schools Project,10.1353/lib.2006.0051,citation_and_abstract_only,peer_reviewed_journal_article,empirical_study,qualitative_study,not_identified,public_library,unspecified_game_format,not_applicable,teens,not_applicable,promising_evidence,skilled_facilitation_required
radniecki2024,radniecki2024.md,2024,2020s,College & Research Libraries,Library Managers’ Experiences on the Tenure Track,not available from source,citation_and_abstract_only,peer_reviewed_journal_article,empirical_study,survey,not_identified,academic_library,unspecified_game_format,not_applicable,not_applicable,not_applicable,medium,not_applicable
rafferty2015,rafferty2015.md,2015,2010s,Library Trends,"FRBR, Information, and Intertextuality",10.1353/lib.2015.0008,citation_and_abstract_only,peer_reviewed_journal_article,theoretical_or_conceptual,theoretical_or_conceptual,information_behavior_and_practice,academic_library,unspecified_game_format,not_applicable,not_applicable,not_applicable,theoretical_or_conceptual,not_applicable
rafferty2025,rafferty2025.md,2025,2020s,Library Trends,Fiction Genre: From the Academy to the Library,10.1353/lib.2025.a970679,citation_and_abstract_only,peer_reviewed_journal_article,evidence_synthesis,theoretical_or_conceptual,not_identified,school_library,unspecified_game_format,not_applicable,not_applicable,not_applicable,theoretical_or_conceptual,not_applicable
raish2016,raish2016.md,2016,2010s,College & Research Libraries,Employer Perceptions of Critical Information Literacy Skills and Digital Badges,not available from source,citation_and_abstract_only,peer_reviewed_journal_article,empirical_study,survey,information_behavior_and_practice,non_library_context,unspecified_game_format,not_applicable,general_public,not_applicable,medium,not_applicable
rajacic2025,rajacic2025.md,2025,2020s,Information Technology and Libraries,Validation of GDPR Compliance in a Library Management System,10.5860/ital.v44i4.17407,citation_and_abstract_only,peer_reviewed_journal_article,implementation_case,case_or_design_study,not_identified,academic_library,unspecified_game_format,not_applicable,not_applicable,not_applicable,demonstrated_outcome,other
raju2015-1,raju2015-1.md,2015,2010s,Library Trends,Promoting Open Scholarship in Africa: Benefits and Best Library Practices,10.1353/lib.2015.0036,citation_and_abstract_only,peer_reviewed_journal_article,evidence_synthesis,theoretical_or_conceptual,not_identified,academic_library,unspecified_game_format,not_applicable,not_applicable,not_applicable,theoretical_or_conceptual,not_applicable
raju2015,raju2015.md,2015,2010s,Library Trends,LIS Education in the Digital Age for an African Agenda,10.1353/lib.2015.0038,citation_and_abstract_only,peer_reviewed_journal_article,empirical_study,qualitative_study|content_analysis,theoretical_or_conceptual,library_school,unspecified_game_format,professional_capacity,educators|students,institutional_capacity,descriptive_only,not_applicable
ramirez2014,ramirez2014.md,2014,2010s,College & Research Libraries,Do Open Access Electronic Theses and Dissertations Diminish Publishing Opportunities in the Sciences?,not available from source,citation_and_abstract_only,peer_reviewed_journal_article,empirical_study,content_analysis,not_identified,academic_library,unspecified_game_format,not_applicable,not_applicable,not_applicable,medium,not_applicable
rao1971,rao1971.md,1971,1970s,Information Technology and Libraries,Booth Library On-Line Circulation System (BLOC),10.6017/ital.v4i2.5585,citation_and_abstract_only,peer_reviewed_journal_article,implementation_case,none,not_identified,academic_library,unspecified_game_format,collections_and_access,not_applicable,not_applicable,descriptive_only,not_applicable
rao2006,rao2006.md,2006,2000s,Library Trends,Knowledge-Sharing Activities in India,10.1353/lib.2006.0028,citation_and_abstract_only,peer_reviewed_journal_article,evidence_synthesis,none,not_identified,unspecified_library_context,unspecified_game_format,collections_and_access,not_applicable,not_applicable,descriptive_only,not_applicable
rapp2008,rapp2008.md,2008,2000s,Library Trends,Excellence in Evaluation: Early Landmarks at the National Library of Medicine,10.1353/lib.0.0017,citation_and_abstract_only,peer_reviewed_journal_article,evidence_synthesis,content_analysis,not_identified,academic_library,unspecified_game_format,not_applicable,not_applicable,not_applicable,theoretical_or_conceptual,not_applicable
rastogi1981,rastogi1981.md,1981,1980s,Information Technology and Libraries,OCLC Search Key Usage Patterns in a Large Research Library,10.6017/ital.v14i2.5277,citation_and_abstract_only,peer_reviewed_journal_article,empirical_study,content_analysis,not_identified,academic_library,unspecified_game_format,collections_and_access,not_applicable,not_applicable,descriptive_only,not_applicable
rasuli2019,rasuli2019.md,2019,2010s,College & Research Libraries,Electronic Theses and Dissertations Programs: A Review of the Critical Success Factors,not available from source,citation_and_abstract_only,peer_reviewed_journal_article,evidence_synthesis,evidence_synthesis,not_identified,academic_library,unspecified_game_format,collections_and_access,not_applicable,institutional_capacity,theoretical_or_conceptual,not_applicable
rathbungrubb2009,rathbungrubb2009.md,2009,2000s,Library Trends,Public Librarianship as a Career: Challenges and Prospects,10.1353/lib.0.0083,citation_and_abstract_only,peer_reviewed_journal_article,evidence_synthesis,unspecified,not_identified,public_library,unspecified_game_format,not_applicable,not_applicable,not_applicable,not_applicable,not_applicable
rather2013,rather2013.md,2013,2010s,Information Technology and Libraries,The MARC Sort Program,10.6017/ital.v2i3.4658,citation_and_abstract_only,peer_reviewed_journal_article,practitioner_reflection,none,not_identified,unspecified_library_context,unspecified_game_format,not_applicable,not_applicable,not_applicable,not_applicable,not_applicable
ravuri2025,ravuri2025.md,2025,2020s,Library Trends,AI on the Shoulders of Giants: Using Kuhlthau’s Information Search Process to Improve AI Support for Information-Seeking,10.1353/lib.2025.a961195,citation_and_abstract_only,peer_reviewed_journal_article,empirical_study,content_analysis,"information_behavior_and_practice, theoretical_or_conceptual",academic_library,unspecified_game_format,"learning_and_literacy, discovery_and_advisory",general_public,learning_and_literacy,promising_evidence,"skilled_facilitation_required, evaluation_or_reflection"
rawls2022,rawls2022.md,2022,2020s,College & Research Libraries,"Erin A. Cech. The Trouble with Passion: How Searching for Fulfillment at Work Fosters Inequality. Los Angeles, CA: University of California Press, 2021. 344p. Paper, $29.95 (ISBN: 978-0520303232).",not available from source,citation_and_abstract_only,peer_reviewed_journal_article,theoretical_or_conceptual,theoretical_or_conceptual,theoretical_or_conceptual,unspecified_library_context,unspecified_game_format,not_applicable,not_applicable,not_applicable,theoretical_or_conceptual,not_applicable
rayward2014,rayward2014.md,2014,2010s,Library Trends,"Information Revolutions, the Information Society, and the Future of the History of Information Science",10.1353/lib.2014.0001,citation_and_abstract_only,peer_reviewed_journal_article,evidence_synthesis,theoretical_or_conceptual,not_identified,unspecified_library_context,unspecified_game_format,not_applicable,not_applicable,not_applicable,theoretical_or_conceptual,not_applicable
real2014,real2014.md,2014,2010s,Information Technology and Libraries,Rural Public Libraries and Digital Inclusion: Issues and Challenges,10.6017/ital.v33i1.5141,citation_and_abstract_only,peer_reviewed_journal_article,evidence_synthesis,evidence_synthesis,social_equity_and_access,public_library,unspecified_game_format,not_applicable,not_applicable,not_applicable,theoretical_or_conceptual,access_infrastructure_required|sustainable_operations
rebmann2017,rebmann2017.md,2017,2010s,Information Technology and Libraries,TV Whites Spaces in Public Libraries: A Primer,10.6017/ital.v36i1.9720,citation_and_abstract_only,peer_reviewed_journal_article,evidence_synthesis,unspecified,not_identified,public_library,unspecified_game_format,outreach_and_partnerships,underserved_or_special_population,equitable_access,descriptive_only,access_infrastructure_required|sustainable_operations
reed2020,reed2020.md,2020,2020s,Information Technology and Libraries,Applying Gamification to the Library Orientation,10.6017/ital.v39i3.12209,citation_and_abstract_only,peer_reviewed_journal_article,empirical_study,survey,not_identified,academic_library,gamification,discovery_and_advisory,undergraduate students|graduate students|faculty|community members,engagement_and_participation,demonstrated_outcome,access_infrastructure_required
reed2025,reed2025.md,2025,2020s,College & Research Libraries,Ongoing Changes in Virtual Reference and Online Instruction in Academic Libraries,not available from source,citation_and_abstract_only,peer_reviewed_journal_article,empirical_study,survey,not_identified,academic_library,unspecified_game_format,not_applicable,not_applicable,not_applicable,descriptive_only,not_applicable
regalado2015,regalado2015.md,2015,2010s,College & Research Libraries,“I Am More Productive in the Library Because It’s Quiet”: Commuter Students in the College Library,not available from source,citation_and_abstract_only,peer_reviewed_journal_article,empirical_study,qualitative_study,not_identified,academic_library,unspecified_game_format,not_applicable,students,not_applicable,practitioner_knowledge,not_applicable
regazzi2012,regazzi2012.md,2012,2010s,College & Research Libraries,"Constrained? An Analysis of U.S. Academic Library Shifts in Spending, Staffing, and Utilization, 1998–2008",not available from source,citation_and_abstract_only,peer_reviewed_journal_article,empirical_study,evidence_synthesis,not_identified,academic_library,unspecified_game_format,not_applicable,not_applicable,not_applicable,descriptive_only,not_applicable
reich2009,reich2009.md,2009,2000s,Library Trends,"Distributed Digital Preservation: Private LOCKSS Networks as Business, Social, and Technical Frameworks",10.1353/lib.0.0047,citation_and_abstract_only,peer_reviewed_journal_article,theoretical_or_conceptual,none,not_identified,academic_library,unspecified_game_format,collections_and_access,not_applicable,cultural_stewardship_and_preservation,theoretical_or_conceptual,not_applicable
reiter2019,reiter2019.md,2019,2010s,College & Research Libraries,Library Support for Student Financial Literacy: A Survey of Librarians at Large Academic Institutions,not available from source,citation_and_abstract_only,peer_reviewed_journal_article,empirical_study,survey,information_behavior_and_practice,academic_library,unspecified_game_format,learning_and_literacy,students,learning_and_literacy,descriptive_only,not_applicable
rempel2010,rempel2010.md,2010,2010s,College & Research Libraries,A Longitudinal Assessment of Graduate Student Research Behavior and the Impact of Attending a Library Literature Review Workshop,not available from source,citation_and_abstract_only,peer_reviewed_journal_article,empirical_study,unspecified,not_applicable,academic_library,unspecified_game_format,professional_capacity,students,institutional_capacity,demonstrated_outcome,community_assessment_needed
rennick2019,rennick2019.md,2019,2010s,Information Technology and Libraries,Library Services Navigation: Improving the Online User Experience,10.6017/ital.v38i1.10844,citation_and_abstract_only,peer_reviewed_journal_article,implementation_case,case_or_design_study,not_identified,academic_library,unspecified_game_format,discovery_and_advisory,general_public,discovery_and_advisory,descriptive_only,sustainable_operations
reside2024,reside2024.md,2024,2020s,College & Research Libraries,"Big Fiction: How Conglomeration Changed the Publishing Industry and American Literature, Dan Sinykin. Columbia University Press, 2023. Softcover, $30.00. 9780231192958",not available from source,citation_and_abstract_only,peer_reviewed_journal_article,evidence_synthesis,unspecified,not_identified,non_library_context,unspecified_game_format,not_applicable,not_applicable,not_applicable,theoretical_or_conceptual,not_applicable
reuter2024,reuter2024.md,2024,2020s,Information Technology and Libraries,Making Magic Happen,10.5860/ital.v43i2.17133,citation_and_abstract_only,peer_reviewed_journal_article,implementation_case,none,not_identified,public_library,unspecified_game_format,discovery_and_advisory,general_public,discovery_and_advisory,descriptive_only,access_infrastructure_required|skilled_facilitation_required
richardson1998,richardson1998.md,1998,1990s,College & Research Libraries,Question Master: An Evaluation of a Web-Based Decision-Support System for Use in Reference Environments,not available from source,citation_and_abstract_only,peer_reviewed_journal_article,empirical_study,unspecified,not_identified,unspecified_library_context,unspecified_game_format,discovery_and_advisory,educators,discovery_and_advisory,medium,not_applicable
richardson1999,richardson1999.md,1999,1990s,College & Research Libraries,Understanding the Reference Transaction: A Systems Analysis Perspective,not available from source,citation_and_abstract_only,peer_reviewed_journal_article,theoretical_or_conceptual,theoretical_or_conceptual,not_identified,academic_library,unspecified_game_format,not_applicable,not_applicable,not_applicable,theoretical_or_conceptual,not_applicable
richter2014,richter2014.md,2014,2010s,Library Trends,"The Development of Czech Libraries, 1990–2013",10.1353/lib.2014.0041,citation_and_abstract_only,peer_reviewed_journal_article,evidence_synthesis,evidence_synthesis,not_identified,academic_library,unspecified_game_format,not_applicable,not_applicable,not_applicable,descriptive_only,not_applicable
ricker2006,ricker2006.md,2006,2000s,Library Trends,GIS Mentoring,10.1353/lib.2006.0061,citation_and_abstract_only,peer_reviewed_journal_article,practitioner_reflection,theoretical_or_conceptual,not_identified,academic_library,unspecified_game_format,professional_capacity,"students, educators",institutional_capacity,theoretical_or_conceptual,not_applicable
ridley2021,ridley2021.md,2021,2020s,Information Technology and Libraries,Algorithmic Literacy and the Role for Libraries,10.6017/ital.v40i2.12963,citation_and_abstract_only,peer_reviewed_journal_article,theoretical_or_conceptual,theoretical_or_conceptual,information_behavior_and_practice,unspecified_library_context,unspecified_game_format,learning_and_literacy,not_applicable,learning_and_literacy,theoretical_or_conceptual,not_applicable
